<?xml version="1.0" encoding="utf-8"?>
<xs:schema xmlns:xs="http://www.w3.org/2001/XMLSchema" attributeFormDefault="unqualified" elementFormDefault="qualified">
    <xs:element name="products">
        <xs:complexType>
            <xs:sequence>
               <xs:element name="product" maxOccurs="unbounded" minOccurs="0">
                    <xs:complexType>
                        <xs:sequence>
                            <xs:element name="id" type="xs:int" />
                            <xs:element name="name" type="xs:string" />
                            <xs:element name="price" type="xs:double" />
                            <xs:element name="amount" type="xs:int" />
                        </xs:sequence>
                    </xs:complexType>
                </xs:element>
            </xs:sequence>
        </xs:complexType>
    </xs:element>
</xs:schema>